{
  "public_id": "pvl_000000000000000000000002",
  "protocol": "wireguard",
  "endpoint_host": "wireguard.example.invalid",
  "endpoint_ip": "2001:db8::20",
  "endpoint_port": 51820,
  "country_code": "US",
  "country_name": "Synthetic United States example",
  "city": null,
  "asn": null,
  "org": null,
  "server_public_key": "AAAAAAAAAAAAAAAAAAAAAAAAAAAAAAAAAAAAAAAAAAA=",
  "distribution_mode": "metadata_only",
  "provisioning_type": "none",
  "source_name": "Synthetic fixture",
  "source_url": "https://example.invalid/wireguard-source",
  "source_license": "Synthetic fixture only; no third-party data",
  "redistribution_allowed": false,
  "allowed_ips_summary": null,
  "persistent_keepalive": null,
  "mtu": null,
  "availability_status": "online_at_last_check",
  "handshake_ok": true,
  "tunnel_ok": true,
  "egress_ok": true,
  "dns_ok": true,
  "ping_ms": 20.5,
  "jitter_ms": 1.5,
  "packet_loss_percent": 0,
  "download_mbps": 80.25,
  "upload_mbps": 30.5,
  "uptime_percent_24h": 99.5,
  "uptime_percent_7d": null,
  "uptime_percent_30d": null,
  "first_seen_at": "2026-07-01T00:00:00Z",
  "last_checked_at": "2026-07-27T23:59:00Z",
  "last_success_at": "2026-07-27T23:59:00Z",
  "config_updated_at": null,
  "expires_at": "2026-07-28T00:15:00Z",
  "technical_quality_score": 82,
  "risk_flags": [
    "third_party_server",
    "privacy_not_assessed",
    "state_may_change"
  ],
  "server_page_url": "https://example.invalid/servers/pvl_000000000000000000000002",
  "generation_page_url": null
}
